question,answer,tags
What are some symptoms that indicate a dangerous or serious medical problem related to a headache?,"Headaches that aren't explained, headaches that steadily worsen, headaches that develop suddenly and severely, headaches that persist for several days, headaches that cause mental confusion or loss of consciousness, and headaches that happen with seizures.",headache
When should I seek immediate medical attention for a headache?,"You should seek immediate medical attention for a headache if it develops suddenly and severely, persists for several days, causes mental confusion or loss of consciousness, or happens with seizures. You should also seek medical attention if your headache occurs with new dizziness or loss of balance, weakness or paralysis, such as in the arms or legs, numbness, difficulty speaking or understanding speech, or a reddened eye.",headache
What are some other situations where I should seek medical attention for a headache?,"You should also seek medical attention if your headache occurs with a fever, stiff neck, or rash, is accompanied by changes in vision, such as blurring or seeing halos around lights, is serious and follows a recent sore throat or respiratory infection, begins or worsens after a head injury, fall or bump, is triggered by changing the position of your head, coughing, sneezing, bending or physical activity, or is a different type of headache from your usual type and you're older than 50.",headache
What should I do if I get bitten by a tick?,"Remove the tick promptly and carefully using fine-tipped forceps or tweezers to grasp the tick as close to the skin as possible. Gently pull out the tick using a slow and steady upward motion. Avoid twisting or squeezing the tick. Do not handle the tick with bare hands. Do not use petroleum jelly, fingernail polish or a hot match to remove a tick. Secure the tick and take a picture. A picture of the tick can help you and your health care provider identify what type it is and whether you are at risk of a transmitted disease. Wash your hands and the bite site with warm water and soap, rubbing alcohol, or an iodine scrub.",tick bites
When should I seek emergency care after a tick bite?,"Call 911 or your local emergency number if you develop a severe headache, difficulty breathing, paralysis, or heart palpitations.",tick bites
When should I contact my doctor after a tick bite?,"Contact your doctor if you aren't able to completely remove the tick, the rash gets bigger, you develop flu-like signs and symptoms, you think the bite site is infected, or you think you were bitten by a deer tick. If possible, bring the tick, or a photo of the tick, with you to your doctor's appointment.",tick bites
What infections can be transmitted through tick bites?,"Some ticks transmit bacteria that cause illnesses, including Lyme disease and Rocky Mountain spotted fever. In general, to transmit Lyme disease a tick needs to be attached to a person's skin for at least 36 hours. Other infections can be transferred in a few hours or even a few minutes.",tick bites
What are the signs and symptoms of Lyme disease?,"A small bump may appear at the site of the tick bite. If it develops into a larger rash or you develop a rash anywhere, possibly with a bull's-eye pattern, it may indicate Lyme disease. The rash usually appears within 3 to 14 days. Flu-like signs and symptoms such as fever, chills, fatigue, muscle and joint pain, and a headache may also accompany the rash.",tick bites
"What should you do if the foreign object in the nose is a magnet, battery, or expands when wet?",Remove it right away and seek emergency care.,foreign object in the nose
What should you avoid doing if a foreign object becomes lodged in the nose?,"Avoid poking or prodding the object with fingers, cotton swabs or other tools, and don't wash out the object.",foreign object in the nose
What should you do if the object is pushed deeper into the nose?,Don't panic and don't try to remove it. Seek medical assistance right away.,foreign object in the nose
What should you do if the foreign object is stuck in only one nostril?,"Gently close the other nostril with your finger, then blow out gently but firmly through the affected nostril.",foreign object in the nose
What is the 'parent's kiss' method for removing a foreign object from a child's nose?,"Place your mouth over your child's mouth to create a seal, then give a short, sharp puff of air into your child's mouth. This should push the object out of your child's nose. If the object is stuck in one nostril, gently close the other nostril with your finger and blow into your child's mouth.",foreign object in the nose
When should you use tweezers to remove a foreign object from the nose?,"Use tweezers only if the object is easy to see and grasp. Try blowing air out of the nose first, as this might free the object without tweezers.",foreign object in the nose
What should you do if you can't remove the foreign object from the nose?,"Seek help right away if you see symptoms of infection, or if you can't remove the object on the first try. Call for emergency medical assistance or go to your local emergency room if these methods fail.",foreign object in the nose
What should I do first when taking care of a puncture wound?,Wash your hands to prevent infection.,puncture wounds
How can I stop bleeding from a puncture wound?,Apply gentle pressure with a clean bandage or cloth.,puncture wounds
How should I clean a puncture wound?,"Rinse the wound with clear water for 5 to 10 minutes. If dirt or debris remains in the wound, use a washcloth to gently scrub it off. See a doctor if you can't remove all of the dirt or debris.",puncture wounds
What should I do after cleaning a puncture wound?,"Apply a thin layer of an antibiotic cream or ointment (Neosporin, Polysporin). For the first two days, rewash the area and reapply the antibiotic when you change the dressing. Bandages help keep the wound clean, change the dressing daily or whenever the bandage becomes wet or dirty.",puncture wounds
What should I do if I notice signs of infection in a puncture wound?,"See a doctor if the wound isn't healing or you notice any increasing pain, pus, swelling or fever. On light skin, spreading redness is a sign of infection. On dark skin, redness may not be apparent, or the infection's streaks may look purplish-gray or darker than your normal skin.",puncture wounds
When should I seek prompt medical care for a puncture wound?,"You should seek immediate medical help if the wound keeps bleeding after a few minutes of direct pressure, is the result of an animal or human bite, is deep and dirty, is caused by a metal object, is deep and to the head, neck, scrotum, chest or abdomen, or is over a joint and could be deep.",puncture wounds
What should I do if the injured person hasn't had a tetanus shot in the past five years?,"If the wound is deep or dirty, your doctor may recommend a tetanus booster shot. The injured person should have the booster shot within 48 hours of the injury.",puncture wounds
What should I do if the wound was caused by a cat or a dog?,"Try to confirm that its rabies vaccination is up to date. If it was caused by a wild animal, seek advice from your doctor about which animals are most likely to carry rabies.",puncture wounds
What should I do first when caring for a cut or scrape?,Wash your hands to avoid infection.,cuts and scrapes
How can I stop the bleeding?,Apply gentle pressure with a clean bandage or cloth and elevate the wound until bleeding stops.,cuts and scrapes
What should I use to clean the wound?,"Rinse the wound with water and wash around the wound with soap, but don't get soap in the wound. Don't use hydrogen peroxide or iodine as they can be irritating.",cuts and scrapes
What should I do if I can't remove all the dirt or debris from the wound?,See a doctor if you can't remove all debris with a tweezers cleaned with alcohol.,cuts and scrapes
What should I apply to the wound after cleaning?,Apply a thin layer of an antibiotic ointment or petroleum jelly to keep the surface moist and help prevent scarring.,cuts and scrapes
Should I cover the wound?,"Apply a bandage, rolled gauze or gauze held in place with paper tape. Covering the wound keeps it clean. If the injury is just a minor scrape or scratch, leave it uncovered.",cuts and scrapes
How often should I change the dressing on the wound?,Change the dressing at least once a day or whenever the bandage becomes wet or dirty.,cuts and scrapes
Do I need a tetanus shot for a minor cut or scrape?,Get a tetanus shot if you haven't had one in the past five years and the wound is deep or dirty.,cuts and scrapes
When should I see a doctor for a cut or scrape?,"See a doctor if you see signs of infection on the skin or near the wound, such as redness, increasing pain, drainage, warmth or swelling.",cuts and scrapes
What causes nosebleeds?,"Nosebleeds can be caused by changes of season, dryness, scratching, some medicines, and injuries. People on blood thinners may have worse nosebleeds than others.",nosebleeds
When should I seek emergency care for a nosebleed?,"You should seek emergency care if the nosebleed involves a greater than expected amount of blood, lasts longer than 30 minutes, you feel faint or lightheaded, or the nosebleed follows a fall or an accident.",nosebleeds
What should I do for self-care of a common nosebleed?,"Sit up and lean forward. Gently blow your nose. Pinch the nose shut using the thumb and a finger for 10 to 15 minutes. If the bleeding doesn't stop, pinch the nose again for up to 15 minutes. Don't pick or blow the nose, and don't drop the head below the heart or lift anything heavy for many hours. Put a saline gel (Ayr), antibiotic ointment (Neosporin), or petroleum jelly (Vaseline) on the inside of the nose. Use steam, humidifiers, or an ice pack across the bridge of the nose. If you have another nosebleed, try the same first-aid steps again. If the bleeding does not stop, spray both sides of the nose with a nasal spray that has oxymetazoline in it (Afrin) and pinch the nose again. Seek medical help if the bleeding still does not stop.",nosebleeds
When should I contact my doctor regarding nosebleeds?,"You should contact your doctor if you have nosebleeds often and may need to have a blood vessel cauterized. You should also contact your doctor if you have nosebleeds and are taking blood thinners, such as aspirin or warfarin (Jantoven), as your care team may need to change the medicine dose. Additionally, you may consider using a humidifier to add more moisture in your home to help relieve nasal bleeding.",nosebleeds
What should you do if you get a foreign object in your eye?,"Wash your hands with soap and water. Try to flush the object out of your eye with a gentle stream of clean, warm water. Use an eyecup or a small, clean drinking glass positioned with its rim resting on the bone at the base of your eye socket. Another way to flush a foreign object from your eye is to get into a shower and aim a gentle stream of lukewarm water on your forehead over the affected eye while holding your eyelid open. If you're wearing contact lenses, it's best to remove the lens before or while you're irrigating the surface of the eye with water. Sometimes a foreign body can be stuck to the undersurface of the lens.",foreign object in the eye
What should you do to help someone else with a foreign object in their eye?,"Wash your hands with soap and water. Seat the person in a well-lighted area. Gently examine the eye to find the object. Pull the lower lid down and ask the person to look up. Then hold the upper lid while the person looks down. If the object is floating in the tear film on the surface of the eye, try using a medicine dropper filled with clean, warm water to flush it out. Or tilt the head back and irrigate the surface of the eye with clean water from a drinking glass or a gentle stream of tap water.",foreign object in the eye
What precautions should you take when trying to remove a foreign object from the eye?,Don't try to remove an object that's embedded in the eye. Don't rub the eye. Don't try to remove a large object that appears to be embedded in the eye or is sticking out between the lids.,foreign object in the eye
When should you seek emergency care for a foreign object in the eye?,"Get immediate medical help if you can't remove the object with simple irrigation, the object is embedded in the eye, the person with the object in the eye is experiencing abnormal vision, or pain, redness or the sensation of an object in the eye persists more than 24 hours after the object is removed.",foreign object in the eye
What should you do if you feel like there is still an object in your eye even after it has been removed?,Keep in mind that sometimes an object can scratch your eye. This often feels as though the object is still in the eye even after the object has been removed. This sensation can sometimes take 24 hours to go away.,foreign object in the eye
What are the symptoms of food poisoning?,"Symptoms of food poisoning vary with the source of contamination, but generally include diarrhea (which may be bloody), nausea, abdominal pain, vomiting, dehydration, and sometimes a low-grade fever.",foodborne illness
Who is at high risk of developing food poisoning?,"High-risk groups include older adults, infants and young children, people with chronic diseases, and pregnant people.",foodborne illness
What should you do if you develop food poisoning?,"If you develop food poisoning, sip liquids (such as a sports drink or water) to prevent dehydration, take note of urination, and avoid anti-diarrheal medications. Foodborne illness often improves on its own within a few days.",foodborne illness
When should you call your doctor if you have food poisoning?,"You should call your doctor if vomiting persists for more than two days, diarrhea persists for more than several days, diarrhea turns bloody, black, or tarry, fever is 101 F (38.3 C) or higher, lightheadedness or fainting occurs with standing, confusion develops, or worrisome abdominal pain develops.",foodborne illness
When should you seek emergency medical assistance if you have food poisoning?,"You should seek emergency medical assistance if you have severe symptoms (such as severe abdominal pain or watery diarrhea that turns very bloody within 24 hours), belong to a high-risk group, or suspect botulism poisoning.",foodborne illness
What are the symptoms of botulism poisoning?,"Symptoms of botulism usually begin 12 to 36 hours after eating the contaminated food and may include headache, blurred vision, muscle weakness and eventual paralysis. Some people also have nausea and vomiting, constipation, urinary retention, difficulty breathing, and a dry mouth. These symptoms require immediate medical attention.",foodborne illness
What is CPR?,"Cardiopulmonary resuscitation (CPR) is a lifesaving technique used in emergencies, such as a heart attack or near drowning, in which someone's breathing or heartbeat has stopped.",cardiopulmonary resuscitation (cpr)
What is the American Heart Association's recommendation for starting CPR?,The American Heart Association recommends starting CPR with hard and fast chest compressions. This hands-only CPR recommendation applies to both untrained bystanders and first responders.,cardiopulmonary resuscitation (cpr)
What should you do if you're afraid or unsure how to perform CPR correctly?,"If you're afraid to do CPR or unsure how to perform CPR correctly, know that it's always better to try than to do nothing at all. The difference between doing something and doing nothing could be someone's life.",cardiopulmonary resuscitation (cpr)
What should you do if you're untrained in CPR or worried about giving rescue breaths?,"If you're not trained in CPR or worried about giving rescue breaths, then provide hands-only CPR. That means uninterrupted chest compressions of 100 to 120 a minute until paramedics arrive. You don't need to try rescue breathing.",cardiopulmonary resuscitation (cpr)
What should you do if you're well-trained and confident in your ability to perform CPR?,"If you're well-trained and confident in your ability, check to see if there is a pulse and breathing. If there is no pulse or breathing within 10 seconds, begin chest compressions. Start CPR with 30 chest compressions before giving two rescue breaths.",cardiopulmonary resuscitation (cpr)
What should you do if you've previously received CPR training but you're not confident in your abilities?,"If you've previously received CPR training but you're not confident in your abilities, then just do chest compressions at a rate of 100 to 120 a minute.",cardiopulmonary resuscitation (cpr)
Does the above advice apply to newborns?,"No, the above advice applies to situations in which adults, children and infants need CPR, but not newborns (infants up to 4 weeks old).",cardiopulmonary resuscitation (cpr)
What is the purpose of CPR?,"CPR can keep oxygen-rich blood flowing to the brain and other organs until emergency medical treatment can restore a typical heart rhythm. When the heart stops, the body no longer gets oxygen-rich blood. The lack of oxygen-rich blood can cause brain damage in only a few minutes.",cardiopulmonary resuscitation (cpr)
What should you do if you are untrained and need to perform CPR?,"If you are untrained and have immediate access to a phone, call 911 or your local emergency number before beginning CPR. The dispatcher can instruct you in the proper procedures until help arrives. To learn CPR properly, take an accredited first-aid training course, including CPR and how to use an automated external defibrillator (AED).",cardiopulmonary resuscitation (cpr)
What should you check before starting CPR?,"Before starting CPR, you should check if the environment is safe for the person and if the person is conscious or unconscious. If the person appears unconscious, tap or shake his or her shoulder and ask loudly, 'Are you OK?'",cardiopulmonary resuscitation (cpr)
What should you do if the person is unconscious and doesn't respond?,"If the person is unconscious and doesn't respond, and you're with another person who can help, have one person call 911 or the local emergency number and get the automated external defibrillator (AED), if one is available. Have the other person begin CPR. If you are alone and have immediate access to a telephone, call 911 or your local emergency number before beginning CPR. Get the AED if one is available.",cardiopulmonary resuscitation (cpr)
What is the order of steps to perform CPR?,"The American Heart Association uses the letters C-A-B to help people remember the order to perform the steps of CPR. C stands for compressions, A stands for airway, and B stands for breathing.",cardiopulmonary resuscitation (cpr)
What is the most important step in CPR?,Compressions are the most important step in CPR. Compressions mean you'll use your hands to push down hard and fast in a specific way on the person's chest to restore blood flow.,cardiopulmonary resuscitation (cpr)
What are the steps for performing CPR compressions?,"To perform CPR compressions, put the person on his or her back on a firm surface, kneel next to the person's neck and shoulders, place the lower palm (heel) of your hand over the center of the person's chest between the nipples, place your other hand on top of the first hand, keep your elbows straight and position your shoulders directly above your hands, push straight down on (compress) the chest at least 2 inches (5 centimeters) but no more than 2.4 inches (6 centimeters), use your entire body weight (not just your arms) when doing compressions, push hard at a rate of 100 to 120 compressions a minute, and allow the chest to spring back (recoil) after each push. If you haven't been trained in CPR, continue chest compressions until there are signs of movement or until emergency medical personnel take over. If you have been trained in CPR, go on to opening the airway and rescue breathing.",cardiopulmonary resuscitation (cpr)
What should you do after performing 30 chest compressions during CPR?,"If you're trained in CPR and you've performed 30 chest compressions, open the person's airway using the head-tilt, chin-lift maneuver.",cardiopulmonary resuscitation (cpr)
How do you open the airway during CPR?,"Put your palm on the person's forehead and gently tilt the head back. Then with the other hand, gently lift the chin forward to open the airway.",cardiopulmonary resuscitation (cpr)
What is rescue breathing in CPR?,Rescue breathing can be mouth-to-mouth breathing or mouth-to-nose breathing if the mouth is seriously injured or can't be opened. Current recommendations suggest performing rescue breathing using a bag-mask device with a high-efficiency particulate air (HEPA) filter.,cardiopulmonary resuscitation (cpr)
How do you perform mouth-to-mouth rescue breathing during CPR?,"After opening the airway (using the head-tilt, chin-lift maneuver), pinch the nostrils shut for mouth-to-mouth breathing and cover the person's mouth with yours, making a seal. Prepare to give two rescue breaths. Give the first rescue breath — lasting one second — and watch to see if the chest rises. If the chest rises, give a second breath. If the chest doesn't rise, repeat the head-tilt, chin-lift maneuver and then give a second breath. Thirty chest compressions followed by two rescue breaths is considered one cycle. Be careful not to provide too many breaths or to breathe with too much force.",cardiopulmonary resuscitation (cpr)
What should you do after giving rescue breaths during CPR?,Resume chest compressions to restore blood flow.,cardiopulmonary resuscitation (cpr)
What should you do as soon as an automated external defibrillator (AED) is available during CPR?,"Apply it and follow the prompts. Give one shock, then resume chest compressions for two more minutes before giving a second shock.",cardiopulmonary resuscitation (cpr)
What should you do if you're not trained to use an AED during CPR?,A 911 operator or another emergency medical operator may be able to give you instructions.,cardiopulmonary resuscitation (cpr)
When should you stop performing CPR?,Continue CPR until there are signs of movement or emergency medical personnel take over.,cardiopulmonary resuscitation (cpr)
What should you do first if you are alone and didn't see the child collapse when performing CPR on a child?,"Start chest compressions for about two minutes, then quickly call 911 or your local emergency number and get the AED if one is available.",cardiopulmonary resuscitation (cpr)
What should you do first if you are alone and did see the child collapse when performing CPR on a child?,"Call 911 or your local emergency number first, then get the AED if available, and start CPR. If another person is with you, have that person call for help and get the AED while you start CPR.",cardiopulmonary resuscitation (cpr)
What should you do to perform chest compressions when giving CPR to a child?,"Place the child on his or her back on a firm surface. Kneel next to the child's neck and shoulders. Place two hands (or only one hand if the child is very small) on the lower half of the child's breastbone (sternum). Using the heel of one or both hands, press straight down on (compress) the chest about 2 inches (approximately 5 centimeters) but not greater than 2.4 inches (approximately 6 centimeters). Push hard and fast — 100 to 120 compressions a minute.",cardiopulmonary resuscitation (cpr)
What should you do to open the airway when performing CPR on a child?,"If you're trained in CPR and you've performed 30 chest compressions, open the child's airway using the head-tilt, chin-lift maneuver. Place your palm on the child's forehead and gently tilt his or her head back. With the other hand, gently lift the chin forward to open the airway.",cardiopulmonary resuscitation (cpr)
What should you do if you haven't been trained in CPR when giving CPR to a child?,Continue chest compressions until the child moves or until emergency medical personnel take over.,cardiopulmonary resuscitation (cpr)
When should you start rescue breathing when giving CPR to a child?,"If you have been trained in CPR, open the airway and start rescue breathing after performing chest compressions.",cardiopulmonary resuscitation (cpr)
What are the steps for mouth-to-mouth breathing for a child during CPR?,"After using the head-tilt, chin-lift maneuver to open the airway, pinch the child's nostrils shut. Cover the child's mouth with yours, making a seal. Breathe into the child's mouth for one second and watch to see if the chest rises. If it rises, give a second breath. If the chest doesn't rise, repeat the head-tilt, chin-lift maneuver first, and then give the second breath. Be careful not to provide too many breaths or to breathe with too much force. After the two breaths, immediately begin the next cycle of compressions and breaths. Note: If there are two people available to do CPR on the child, change rescuers every two minutes — or sooner if the rescuer is fatigued — and give one to two breaths every 15 compressions.",cardiopulmonary resuscitation (cpr)
What should you do as soon as an AED becomes available during CPR for a child?,"As soon as an AED is available, apply it and follow the prompts. Use pediatric pads for children older than 4 weeks old and up to age 8. If pediatric pads aren't available, use adult pads. Give one shock, then restart CPR — starting with chest compressions — for two more minutes before giving a second shock. If you're not trained to use an AED, a 911 operator or another emergency medical operator may be able to give you directions.",cardiopulmonary resuscitation (cpr)
