question,answer,tags
How should you perform CPR on a baby 4 weeks old or older?,"First, evaluate the situation. Touch the baby and watch for a response, such as movement. Don't shake the baby. If there's no response, call 911 or your local emergency number, then immediately start CPR. Follow the compressions, airway and breathing (C-A-B) procedure for a baby under age 1 (except newborns, which include babies up to 4 weeks old).",cardiopulmonary resuscitation (cpr)
What is the compressions procedure for a baby under age 1 during CPR?,"Place the baby on his or her back on a firm, flat surface, such as a table or floor. Imagine a horizontal line drawn between the baby's nipples. Place two fingers of one hand just below this line, in the center of the chest. Gently compress the chest about 1.5 inches (about 4 centimeters). Count aloud as you push in a fairly rapid rhythm. You should push at a rate of 100 to 120 compressions a minute, just as you would when giving an adult CPR.",cardiopulmonary resuscitation (cpr)
How do you open the airway during CPR for a baby?,"After 30 compressions, gently tip the head back by lifting the chin with one hand and pushing down on the forehead with the other hand.",cardiopulmonary resuscitation (cpr)
What is the process for breathing during CPR for a baby?,"Cover the baby's mouth and nose with your mouth. Prepare to give two rescue breaths. Use the strength of your cheeks to deliver gentle puffs of air (instead of deep breaths from your lungs) to slowly breathe into the baby's mouth one time, taking one second for the breath. Watch to see if the baby's chest rises. If it does, give a second rescue breath. If the chest does not rise, repeat the head-tilt, chin-lift maneuver and then give the second breath. If the baby's chest still doesn't rise, continue chest compressions. Give two breaths after every 30 chest compressions. If two people are performing CPR, give one to two breaths after every 15 chest compressions. Continue CPR until you see signs of life or until medical personnel arrive.",cardiopulmonary resuscitation (cpr)
What should you do if a venomous snake bites you?,"Call 911 or your local emergency number immediately, especially if the bitten area changes color, begins to swell, or is painful. Move beyond the snake's striking distance, remain still and calm to help slow the spread of venom, remove jewelry and tight clothing before you start to swell, position yourself, if possible, so that the bite is at or below the level of your heart, clean the wound with soap and water, and cover it with a clean, dry dressing.",snakebites
What should you not do if a venomous snake bites you?,"Don't use a tourniquet or apply ice, don't cut the wound or attempt to remove the venom, don't drink caffeine or alcohol, which could speed your body's absorption of venom, and don't try to capture the snake.",snakebites
What are the symptoms of a nonvenomous snake bite?,Typical symptoms of the bite from a nonvenomous snake are pain and scratches at the site.,snakebites
What are the symptoms of a venomous snake bite?,"After a bite from a venomous snake, there is severe burning pain at the site within 15 to 30 minutes. This can progress to swelling and bruising at the wound and all the way up the arm or leg. Other signs and symptoms include nausea, labored breathing, a general sense of weakness, and an odd taste in the mouth. Some snakes, such as coral snakes, have toxins that cause neurological symptoms, such as skin tingling, difficulty speaking, and weakness.",snakebites
What should you do if you are bitten by a snake?,"If a venomous snake bites you, call 911 or your local emergency number immediately. Move beyond the snake's striking distance, remain still and calm to help slow the spread of venom, remove jewelry and tight clothing before you start to swell, position yourself, if possible, so that the bite is at or below the level of your heart, clean the wound with soap and water, and cover it with a clean, dry dressing. Don't use a tourniquet or apply ice, don't cut the wound or attempt to remove the venom, don't drink caffeine or alcohol, which could speed your body's absorption of venom, and don't try to capture the snake. Try to remember the snake's color and shape so that you can describe it, which will help in your treatment. If possible, take a picture of the snake from a safe distance to help with identification.",snakebites
Which snakes are venomous in North America?,"Most venomous snakes in North America have eyes like slits and are known as pit vipers. Their heads are triangular and they have fangs. One exception is the coral snake, which has a rounded head and round pupils.",snakebites
What are the signs and symptoms of sunburn?,"The signs and symptoms of sunburn include painful, inflamed, and hot to the touch skin. Blisters might also develop. Additionally, headache, fever, or nausea can be experienced.",sunburn
When should I seek immediate medical care for a sunburn?,"You should seek immediate medical care for sunburn if you experience a fever over 103 degrees Fahrenheit (39.4 degrees Celsius) with vomiting, confusion, an infection in the sunburned area, or dehydration.",sunburn
What are some first aid measures for sunburn?,"Some first aid measures for sunburn include taking a pain reliever such as ibuprofen or acetaminophen, cooling the skin with cool tap water or a cool bath, applying a moisturizer or lotion such as aloe vera or calamine lotion, drinking extra water to prevent dehydration, leaving blisters alone, protecting yourself from further sun exposure, applying nonprescription 1% hydrocortisone cream to the affected area, and treating sunburned eyes by covering them with a clean towel dampened with cool tap water.",sunburn
When should I seek medical care for sunburn?,"You should seek medical care for sunburn if you have large blisters or blisters that form on the face, hands, or genitals, worsening pain, headache, confusion, nausea, fever, chills, eye pain or vision changes, or signs of infection such as blisters with swelling, pus, or streaks.",sunburn
What are the symptoms of a heart attack?,"Someone having a heart attack may have chest pain, pressure or tightness, or a squeezing or aching sensation in the center of the chest. They may also experience pain or discomfort that spreads to the shoulder, arm, back, neck, jaw, teeth, or occasionally upper abdomen. Other symptoms can include nausea, indigestion, heartburn or abdominal pain, shortness of breath, lightheadedness, dizziness, fainting, and sweating.",heart attack
How long does chest pain typically last during a heart attack?,"A heart attack generally causes chest pain for more than 15 minutes. Some people have mild chest pain, while others have more-severe pain. The discomfort is commonly described as a pressure or chest heaviness, although some people have no chest pain or pressure at all.",heart attack
What should you do if you think you or someone else is having a heart attack?,"Call 911 or your local emergency number immediately. Don't ignore the symptoms of a heart attack. If you can't get an ambulance or emergency vehicle to come to you, have a neighbor or a friend drive you to the nearest hospital. Drive yourself only if you have no other option. Chew and swallow an aspirin while waiting for emergency help, and take nitroglycerin if prescribed by a doctor.",heart attack
What should you do if the person having a heart attack is unconscious?,"If the person is unconscious, call for emergency medical help and begin CPR to keep blood flowing. Push hard and fast on the center of the person's chest in a fairly rapid rhythm — about 100 to 120 compressions a minute. If an automated external defibrillator (AED) is immediately available and the person is unconscious, follow the device instructions for using it.",heart attack
What should you do while waiting for emergency help to arrive during a heart attack?,"Chew and swallow an aspirin while waiting for emergency help. Aspirin helps keep your blood from clotting. When taken during a heart attack, it could reduce heart damage. Don't take aspirin if you are allergic to it or have been told by your health care provider never to take aspirin. If you think you're having a heart attack and your health care provider has previously prescribed nitroglycerin for you, take it as directed while waiting for emergency medical help.",heart attack
What is a stroke?,"A stroke happens when there's bleeding into the brain or when blood flow to the brain is blocked. When brain cells are deprived of essential nutrients, they start dying within minutes.",stroke
What should you do in the event of a possible stroke?,"Use F.A.S.T. to help remember warning signs. Face: Does the face droop on one side when the person tries to smile? Arms: Is one arm lower when the person tries to raise both arms? Speech: Can the person repeat a simple sentence? Is speech slurred or hard to understand? Time: During a stroke every minute counts. If you see any of these signs, call 911 or your local emergency number right away.",stroke
What are other signs and symptoms of a stroke?,"Other signs and symptoms of a stroke, which come on suddenly, include: Weakness or numbness on one side of the body, including the face, arm or leg. Dimness, blurring or loss of vision, particularly in one eye. Or sudden double vision. Sudden, severe headache with no clear cause. Unexplained dizziness, unsteadiness or a sudden fall. Especially if dizziness is accompanied by any of the other signs or symptoms.",stroke
What is the importance of seeking immediate medical help in the event of a stroke?,"A stroke is a true emergency. The sooner treatment is given, the more likely it is that damage can be minimized. Every moment counts.",stroke
What are some risk factors for having a stroke?,"Risk factors for having a stroke include having high blood pressure, smoking, having diabetes and having heart disease. Your risk of stroke increases as you age.",stroke
What should I do if the broken bone is the result of major trauma or injury?,"If the broken bone is the result of major trauma or injury, call 911 or your local emergency number.",fractures (broken bones)
When should I call for emergency help?,"Call for emergency help if the person is unresponsive, isn't breathing or isn't moving. Begin CPR if there's no breathing or heartbeat. Also, call for emergency help if there is heavy bleeding, even gentle pressure or movement causes pain, the limb or joint appears deformed, the bone has pierced the skin, the extremity of the injured arm or leg is numb or bluish at the tip, or you suspect a bone is broken in the neck, head, or back.",fractures (broken bones)
Should I move the person if they have a broken bone?,Don't move the person except if necessary to avoid further injury.,fractures (broken bones)
What actions should I take immediately while waiting for medical help?,"Stop any bleeding, immobilize the injured area, apply ice packs to limit swelling and help relieve pain, and treat for shock. Don't try to realign the bone or push a bone that's sticking out back in. If you've been trained in how to splint and professional help isn't readily available, apply a splint to the area above and below the fracture sites. Padding the splints can help reduce discomfort. Don't apply ice directly to the skin. Wrap the ice in a towel, piece of cloth, or some other material. If the person feels faint or is breathing in short, rapid breaths, lay the person down with the head slightly lower than the trunk and, if possible, elevate the legs.",fractures (broken bones)
What is a sprain?,A sprain is an injury to a ligament caused by tearing of the fibers of the ligament.,sprain
What are the most common types of sprains?,"Ankle sprains are the most common type of sprain, but wrist, knee and thumb sprains are also common.",sprain
What is the initial treatment for a minor sprain?,"For most minor sprains, you can start initial injury treatment yourself. Follow the instructions for R.I.C.E., which stands for rest, ice, compress, and elevate.",sprain
What does R.I.C.E. stand for?,"R.I.C.E. stands for rest, ice, compress, and elevate. Rest the injured limb, ice the area, compress the area with an elastic wrap or bandage, and elevate the injured limb above your heart whenever possible to help prevent or limit swelling.",sprain
How long does it take for a sprain to recover?,"Sprains can take days to months to recover. As the pain and swelling improve, gently begin using the injured area. You should feel a gradual, progressive improvement.",sprain
What should you do to restore strength and stability to the injured limb?,It is essential to restore strength and stability to the injured limb prior to a return to sports or fitness activities. A physical therapist or other sports medicine provider can provide you with the appropriate strength and stability exercises to optimize healing and minimize the risk of repeat injury.,sprain
When should you see a doctor for a sprain?,"See your doctor if your sprain isn't improving after two or three days. Get emergency medical assistance if you're unable to bear weight on the injured leg, the joint feels unstable or numb, or you can't use the joint. This may mean the ligament was completely torn. Also seek medical attention if you develop redness or red streaks that spread out from the injured area, you have pain directly over the bones of an injured joint, you have re-injured an area that has been injured a number of times in the past, or you have a severe sprain.",sprain
What is a corneal abrasion?,"A corneal abrasion is a superficial scratch on the clear, protective 'window' at the front of the eye (cornea).",corneal abrasion (scratch)
What are the symptoms of corneal abrasion?,"The symptoms of corneal abrasion include pain, blurry vision, a gritty feeling in the eye, tearing, redness, sensitivity to light (photophobia), and headache.",corneal abrasion (scratch)
What should you do in case of a corneal abrasion?,"In case of a corneal abrasion, seek prompt medical attention. Meanwhile, rinse your eye with clean water or a saline solution, blink several times, and pull the upper eyelid over the lower eyelid. Avoid making the injury worse by not trying to remove an embedded object, not rubbing your eye after an injury, not touching your eye with cotton swabs or other instruments, and not wearing contact lenses while your eye is healing.",corneal abrasion (scratch)
How long does it take for most corneal abrasions to heal?,Most corneal abrasions heal in a few days but should be treated with antibiotic drops or ointment to reduce the risk of infection.,corneal abrasion (scratch)
What is hypothermia?,Hypothermia occurs when your body loses heat faster than it can produce heat and your body temperature falls below 95 F (35 C).,hypothermia
What are the causes of hypothermia?,Hypothermia is often caused by exposure to cold weather or immersion in a cold body of water. It can also be caused by ongoing exposure to indoor temperatures below 50 F (10 C). You could be at increased risk if you're also exhausted or dehydrated.,hypothermia
What are the signs and symptoms of hypothermia?,"Signs and symptoms of hypothermia usually develop slowly and may include shivering, though this may stop as body temperature drops, slurred speech or mumbling, slow, shallow breathing, weak pulse, clumsiness or lack of coordination, drowsiness or very low energy, confusion or memory loss, loss of consciousness, and bright red, cold skin (in infants).",hypothermia
What should I do if I suspect someone has hypothermia?,"If you suspect someone has hypothermia, call 911 or your local emergency number. Then immediately take these steps: gently move the person out of the cold, remove wet clothing, offer warm, dry coats or blankets, gradually warm the person with warm, dry compresses or an electric blanket, offer warm, sweet, nonalcoholic drinks, and begin CPR if the person shows no signs of life.",hypothermia
What should I avoid doing when treating someone with hypothermia?,"When treating someone with hypothermia, you should avoid rewarming the person too quickly, such as with a heating lamp or hot bath. Don't attempt to warm the arms and legs, as heating or massaging the limbs of someone in this condition can stress the heart and lungs. Finally, don't give the person alcohol or cigarettes, as alcohol hinders the rewarming process and tobacco products interfere with circulation that is needed for rewarming.",hypothermia
How should I handle a tooth that has been knocked out?,"Handle the tooth by the top or crown only, and don't touch the roots.",tooth loss
What should I do if my tooth has dirt or foreign material on it?,"Gently rinse the tooth briefly in a bowl of lukewarm tap water for no more than 10 seconds to remove debris. Don't hold it under running water, as this could kill the cells on the root surface that help reattach the tooth.",tooth loss
What should I do if I can't put the tooth back in the socket?,"If you can't put the tooth back in the socket, immediately place it between your cheek and gum, or in cold milk or your own saliva. Alternatively, use an over-the-counter product that preserves a knocked-out tooth if you have quick access to it.",tooth loss
Should I try to reimplant the tooth myself?,"Try to put the tooth back in the socket if possible. If it doesn't go all the way into place, bite down slowly and gently on gauze or a moistened paper towel to help keep it in place. Hold the tooth in place until you see your dentist. If you can't reimplant the tooth yourself, get emergency dental care.",tooth loss
What should I do if I can't get to a dentist right away?,"If your dentist's office isn't open, go to the emergency room.",tooth loss
Are baby teeth implanted if they're knocked out?,"No, baby teeth (primary teeth) are not implanted if they're knocked out.",tooth loss
How long do I have to reimplant the tooth for it to have a good chance of success?,"Reimplantation should occur within two hours after the tooth is knocked out. Sooner is better, as the likelihood of success becomes poor after this time frame.",tooth loss
What are some common causes of chest pain?,"Causes of chest pain can vary from minor problems, such as heartburn or emotional stress, to serious medical emergencies, such as a heart attack or blood clot in the lungs (pulmonary embolism).",chest pain
What are the symptoms of a heart attack?,"Someone having a heart attack may have chest pain, pressure or tightness, or a squeezing or aching sensation in the center of the chest, pain or discomfort that spreads to the shoulder, arm, back, neck, jaw, teeth or occasionally upper abdomen, nausea, indigestion, heartburn or abdominal pain, shortness of breath, lightheadedness, dizziness, fainting, and sweating.",chest pain
What should I do if I or someone else may be having a heart attack?,"Call 911 or emergency medical assistance, chew aspirin if not allergic or otherwise instructed not to do so, take nitroglycerin if prescribed, begin CPR if necessary, and follow instructions for using an AED if available.",chest pain
What is angina?,Angina is chest pain or discomfort caused by reduced blood flow to your heart muscle.,chest pain
What is the difference between stable and unstable angina?,"Stable angina is chest pain that usually occurs with activity and is relatively predictable. The chest pain tends to follow a pattern. Unstable angina is chest pain that is sudden or new or changes from the typical pattern, and may be a sign of a future heart attack.",chest pain
What should I do if my angina gets worse or changes?,Seek emergency medical help immediately.,chest pain
What is a pulmonary embolism?,"A pulmonary embolism is a blood clot in the lung that interrupts blood flow, making it more difficult for your lungs to provide oxygen to the rest of your body. Symptoms may include sudden, sharp chest pain often with shortness of breath, cough that may produce blood-streaked spit, rapid heartbeat with shortness of breath, fainting, severe anxiety, unexplained sweating, and swelling of one leg only caused by a blood clot in the leg.",chest pain
What is an aortic dissection?,"An aortic dissection is a tear in the inner layer of the aorta, the large blood vessel branching off the heart. Symptoms may include sudden severe chest or upper back pain, often described as a tearing, ripping or shearing sensation, that radiates to the neck or down the back, loss of consciousness (fainting), shortness of breath, sudden difficulty speaking, loss of vision, weakness or paralysis of one side of your body, such as having a stroke, heavy sweating, and weak pulse in one arm compared with the other.",chest pain
What are the signs and symptoms of pneumonia with pleurisy?,"Frequent signs and symptoms of pneumonia are chest pain accompanied by chills, fever and a cough that may produce bloody or foul-smelling sputum. Pleurisy is inflammation of the membranes that surround the lung (pleura). It can cause chest pain when taking a breath or coughing. Unlike a true heart attack, pleurisy pain is usually relieved temporarily by holding your breath or putting pressure on the painful area of your chest.",chest pain
What is pericarditis?,"Pericarditis is swelling and irritation of the thin, saclike tissue surrounding your heart (pericardium). Pericarditis can cause sharp chest pain that gets worse when you cough, lie down, or take a deep breath. Pericarditis is usually mild and goes away without treatment. If it's severe, you may need medication or, rarely, surgery. It may be difficult to tell the difference between sudden (acute) pericarditis and pain due to a heart attack. If you have sudden, unexplained chest pain, seek emergency medical help.",chest pain
What is pulmonary embolism and what are its symptoms?,"Pulmonary embolism is a blood clot in the lung, and its symptoms may include sudden, sharp chest pain often with shortness of breath, sudden unexplained shortness of breath, cough that may produce blood-streaked spit, rapid heartbeat with shortness of breath, fainting, severe anxiety, unexplained sweating, and swelling of one leg only, caused by a blood clot in the leg.",chest pain
What is aortic dissection and what are its symptoms?,"Aortic dissection is a tear in the inner layer of the aorta, and its symptoms may include sudden severe chest or upper back pain, often described as a tearing, ripping or shearing sensation, that radiates to the neck or down the back, loss of consciousness (fainting), shortness of breath, sudden difficulty speaking, loss of vision, weakness or paralysis of one side of your body, such as having a stroke, heavy sweating, and weak pulse in one arm compared with the other.",chest pain
What is pneumonia with pleurisy and what are its symptoms?,"Pneumonia with pleurisy can cause chest pain when taking a breath or coughing and is accompanied by chills, fever, and a cough that may produce bloody or foul-smelling sputum.",chest pain
What is pericarditis and what are its symptoms?,"Pericarditis is swelling and irritation of the thin, saclike tissue surrounding your heart, and its symptoms include sharp chest pain that gets worse when you cough, lie down, or take a deep breath.",chest pain
"What is chest wall pain, and what can cause it?","Chest wall pain is a type of muscle pain, and bruised chest muscles, excessive coughing, straining, or minor injury can cause harmless chest pain. One type of chest wall pain is costochondritis, which causes pain and tenderness in and around the cartilage that connects your ribs to your breastbone.",chest pain
When should I see a doctor for chest pain?,"If your chest pain is new, changing or otherwise unexplained, seek help from a health care provider. If you think you're having a heart attack, call 911 or your local emergency number. Don't try to diagnose the chest pain yourself or ignore it. Your treatment will depend on the specific cause of the pain.",chest pain
Why can human bites be dangerous?,Human bites can be as dangerous as or even more dangerous than animal bites because of the types of bacteria and viruses contained in the human mouth.,human bites
What is considered a human bite?,"If someone cuts his or her knuckles on another person's teeth, as might happen in a fight, this is also considered a human bite. And a cut on the knuckles from your own teeth, such as from a fall, is considered a human bite.",human bites
How should you take care of a human bite that breaks the skin?,"Stop the bleeding by applying pressure with a clean, dry cloth. Wash the wound thoroughly with soap and water. Apply a clean bandage. Cover the affected area with a nonstick bandage. Seek emergency medical care.",human bites
What should you do if you haven't had a tetanus shot within five years?,"If you haven't had a tetanus shot within five years, your doctor may recommend a booster. In this case, get the booster shot within 48 hours of the injury.",human bites
What is the primary cause of toothaches for most children and adults?,Tooth decay is the primary cause of toothaches for most children and adults.,toothache
What are some other causes of a toothache?,"Other causes of a toothache can include: an accumulation of food and debris between your teeth, inflammation or infection at the root of the tooth or in the gums, trauma to the tooth, sudden fracture of the tooth or tooth root, a split in the tooth that occurs over time, teeth that start to appear (erupt) through the gums, and a sinus infection that can be felt as pain in the teeth.",toothache
