question,answer,tags
What should you do to treat a mild reaction to an insect bite or sting?,"To treat a mild reaction to an insect bite or sting, move to a safe area to avoid more bites or stings, remove any stingers, gently wash the area with soap and water, apply a cloth dampened with cold water or filled with ice to the area of the bite or sting for 10 to 20 minutes, raise the affected arm or leg, apply calamine lotion, baking soda paste, or 0.5% or 1% hydrocortisone cream to the affected area several times a day until your symptoms go away, take an anti-itch medicine (antihistamine) by mouth to reduce itching, and take a nonprescription pain reliever as needed.",insect bites and stings
When should you seek medical care for an insect bite or sting?,"You should seek medical care if the swelling gets worse, the site shows signs of infection, or you don't feel well.",insect bites and stings
When should you call 911 or your local medical emergency number for an insect bite or sting?,"You should call 911 or your local medical emergency number if a child is stung by a scorpion or if anyone is having a serious reaction that suggests anaphylaxis, such as trouble breathing, swelling of the lips, face, eyelids or throat, dizziness, fainting or unconsciousness, a weak and rapid pulse, hives, or nausea, vomiting or diarrhea.",insect bites and stings
What should you do while waiting for medical help if someone is having a serious reaction to an insect bite or sting?,"While waiting for medical help if someone is having a serious reaction to an insect bite or sting, ask whether the injured person is carrying an epinephrine autoinjector (EpiPen, Auvi-Q, others) and ask whether you should help inject the medication. Loosen tight clothing and cover the person with a blanket. Don't offer anything to drink. If needed, position the person to prevent choking on vomit.",insect bites and stings
What is motion sickness?,"Motion sickness is a feeling of uneasiness, dizziness, and vomiting that can occur when traveling by any type of transportation.",motion sickness
How can I avoid motion sickness while traveling?,"You can avoid motion sickness by planning ahead and avoiding sitting in the rear of the vehicle or in seats that face backward. You should also focus on the horizon or on a distant, stationary object while traveling, keep your head still, avoid smoking and strong odors, and take an antihistamine, ginger, or eat lightly to help curb nausea.",motion sickness
What are some tips for traveling by ship to avoid motion sickness?,"If traveling by ship, you should request a cabin in the front or middle of the ship near the water level to avoid motion sickness.",motion sickness
What are some tips for traveling by plane to avoid motion sickness?,"If traveling by plane, you should ask for a seat over the front edge of a wing and direct the air vent flow to your face to avoid motion sickness.",motion sickness
What are some tips for traveling by train to avoid motion sickness?,"If traveling by train, you should take a forward-facing seat near the front and next to a window to avoid motion sickness.",motion sickness
What are some tips for traveling by automobile to avoid motion sickness?,"If traveling by automobile, you should drive or sit in the front passenger's seat and children should be in age-appropriate seats and restraints to avoid motion sickness.",motion sickness
What medications can I take to prevent motion sickness?,"You can take antihistamines such as dimenhydrinate or meclizine, at least 30 to 60 minutes before traveling to prevent motion sickness. Scopolamine is also available in a prescription adhesive patch called Transderm Scop. Talk to your healthcare provider before using scopolamine if you have health problems such as glaucoma or urine retention. Ginger supplements, ginger ale, or candied ginger may also help curb nausea.",motion sickness
What is frostbite?,"Frostbite is when skin and underlying tissues freeze after being exposed to very cold temperatures, usually affecting areas like the fingertips, toes, earlobes, cheeks, chin and tip of the nose.",frostbite
What are the early signs and symptoms of frostbite?,"Early signs and symptoms of frostbite include patches of reddish skin and burning pain. The condition then progresses to cold, numb, white or grayish skin that feels stiff or looks waxy.",frostbite
What should you do if you suspect hypothermia?,"Get emergency medical help if you suspect hypothermia. Signs of hypothermia include intense shivering, drowsiness, confusion, fumbling hands and slurred speech.",frostbite
What should you do to protect frostbitten skin from further damage?,"If there's any chance the affected areas will freeze again, don't thaw them. If they're already thawed, wrap them up so that they don't refreeze.",frostbite
How should you warm frostbitten hands if you're outside?,"Warm frostbitten hands by tucking them into your armpits. Protect your face, nose or ears by covering the area with dry, gloved hands. Don't rub the affected skin with snow or anything else. And don't walk on frostbitten feet or toes if possible.",frostbite
What should you do once you're in a warm space after being in the cold with frostbite?,"Once you're in a warm space, remove wet clothes and wrap up in a warm blanket.",frostbite
How should you gently rewarm frostbitten areas?,"Soak frostbitten fingers, toes or other extremities in warm water — 105 to 110 F (about 40 to 43 C). If a thermometer isn't available, test the water by placing an uninjured hand or elbow in it — it should feel very warm, not hot. Soak for 20 to 30 minutes or until the skin becomes its normal color or loses its numbness. For the face or ears, apply a warm, wet washcloth.",frostbite
What should you avoid when rewarming frostbitten skin?,"Don't rewarm frostbitten skin with direct heat, such as a stove, heat lamp, fireplace or heating pad. This can cause burns.",frostbite
What should you drink to help warm yourself from the inside if you have frostbite?,"Drink warm liquids like tea, coffee, hot chocolate or soup to help warm you from the inside. Don't drink alcohol.",frostbite
Should you consider taking pain medicine for frostbite?,"If you're in pain, consider an over-the-counter pain reliever.",frostbite
What should you expect as skin thaws during frostbite treatment?,You'll feel tingling and burning as the skin warms and normal blood flow returns. Take care to not break any blisters that may form on the affected skin. Seek medical help for anything more serious than mild frostbite.,frostbite
What should you do for a minor animal bite or claw wound?,"Wash the wound thoroughly with soap and water, apply an antibiotic cream or ointment, and cover the bite with a clean bandage.",animal bites: first aid
When should you seek prompt medical care for an animal bite?,"You should seek prompt medical care if the wound is a deep puncture or you're not sure how serious it is, the skin is badly torn, crushed or bleeding significantly, you notice increasing swelling, redness, pain or oozing, or you have questions about your risk of rabies or about rabies prevention.",animal bites: first aid
What should you do if the bite was caused by a cat or a dog?,Try to confirm that the animal's rabies vaccination is up to date.,animal bites: first aid
What should you do if the bite was caused by a wild animal?,Seek advice from your doctor about which animals are most likely to carry rabies.,animal bites: first aid
"Why should you seek medical advice about rabies shots if you come into contact with bats, even if you don't think you've been bitten?",Bats often carry rabies and can infect humans without leaving obvious signs of a bite.,animal bites: first aid
How often should you get a tetanus shot after an animal bite?,If you haven't had a tetanus shot in the past 10 years — or 5 years if the wound is deep or dirty — you may need a booster shot.,animal bites: first aid
What are some sources of electricity that can cause electrical burns?,"Examples of sources of electricity that can cause electrical burns include lightning, stun guns, and contact with job site or household current.",electrical burns
How should minor electrical skin burns be treated?,"Minor electrical skin burns should be treated like any other minor burn. Put a cool wet cloth on the area. Do not break any blisters. After you gently clean the skin, put a bandage on the area. If you have any questions about how severe the burn is, contact a health care provider.",electrical burns
When should you contact a health care provider after an electrical burn?,"A person who has been injured by contact with electricity should be seen by a health care provider. The damage may be worse than it looks from the burn on the skin. Sometimes an electrical injury can cause damage to skin, muscles, blood vessels and nerves, often in an arm or a leg. The heart, brain and other body organs can be damaged.",electrical burns
What precautions should you take if someone has been injured by contact with electricity?,"If someone has been injured by contact with electricity, don't touch the injured person if they are still in contact with the electrical current. Call 911 or your local emergency number if the source of the burn is a high-voltage wire or lightning. Don't get near high-voltage wires until the power is turned off. Overhead power lines usually aren't insulated. Stay at least 50 feet (about 15 meters) away — farther if wires are jumping and sparking. Don't drive over downed power lines. If a live electrical line contacts the vehicle you're in, stay in the vehicle. Call 911 or your local emergency number to disable the power line before touching any metal to try to exit the vehicle. Don't move a person with an electrical injury unless the person is in immediate danger.",electrical burns
When should emergency care be sought after an electrical burn?,"Emergency care should be sought if the injured person experiences severe burns, confusion, difficulty breathing, irregular heart rhythm (arrhythmias), does not have a pulse and is not breathing (cardiac arrest), muscle pain and contractions, seizures, or loss of consciousness.",electrical burns
What should be done immediately while waiting for medical help after an electrical burn?,"Immediately turn off the source of electricity if possible. If not, move the source away from both you and the injured person using a dry, nonconducting object made of cardboard, plastic, or wood. Begin CPR if the person is not breathing, coughing or moving and doesn't have a pulse. Do not remove clothing or try to clean the burned area. Cover any burned areas with a sterile gauze bandage, if available, or a clean cloth or sheet. Don't use a blanket or towel, because fuzz or loose fibers can stick to the burns. Try to prevent the injured person from becoming chilled.",electrical burns
What is fainting?,Fainting occurs when the brain doesn't receive enough blood for a brief time. This causes loss of consciousness.,fainting
What should you do if you feel faint?,"Lie down or sit down. To reduce the chance of fainting again, don't get up too quickly. Place your head between your knees if you sit down.",fainting
What should you do if someone else faints?,"Position the person on the back. If there are no injuries and the person is breathing, raise the person's legs above heart level if possible. Prop up the person's legs about 12 inches (30 centimeters). Loosen belts, collars or other tight clothing. To reduce the chance of fainting again, don't get the person up too fast. If the person doesn't regain consciousness within one minute, call 911 or your local emergency number.",fainting
What should you do if the person who fainted is not breathing?,"Check for breathing. Check for a pulse and to see if the person is breathing. If the person is not breathing, begin CPR. Call 911 or your local emergency number. Continue CPR until help arrives or the person begins to breathe.",fainting
What should you do if the person who fainted was injured in a fall?,"Treat bumps, bruises or cuts appropriately. Control bleeding with direct pressure.",fainting
When should you talk to your health care provider if you faint?,Talk to your health care provider if you faint more than once.,fainting
What should you do if you suspect a serious head injury?,Call 911 or your local emergency number.,head trauma
What are the symptoms of a serious head injury in adults?,"Severe head or facial bleeding, bleeding or fluid leakage from the nose or ears, vomiting, severe headache, change in consciousness for more than a few seconds, black-and-blue discoloration below the eyes or behind the ears, not breathing, confusion, agitation, loss of balance, weakness or an inability to use an arm or leg, unequal pupil size, slurred speech, seizures.",head trauma
What are the symptoms of a serious head injury in children?,"Any of the symptoms for adults, persistent crying, refusal to eat, bulging in the soft spot on the front of the head of infants, repeated vomiting.",head trauma
What first aid steps should you take while waiting for emergency medical help to arrive for someone with head trauma?,"Keep the person still. The injured person should lie down with the head and shoulders slightly elevated. Don't move the person unless necessary. Avoid moving the person's neck. If the person is wearing a helmet, don't remove it. Stop any bleeding. Apply firm pressure to the wound with sterile gauze or a clean cloth. But don't apply direct pressure to the wound if you suspect a skull fracture. Watch for changes in breathing and alertness. If the person shows no signs of circulation — no breathing, coughing or movement — begin CPR.",head trauma
What are the concussion symptoms that require evaluation by a medical professional?,"Nausea, unsteadiness, headaches, or difficulty concentrating.",head trauma
What is heat exhaustion?,"Heat exhaustion is a heat-related syndrome that occurs when the body loses too much water or salt, usually from excessive sweating or dehydration. It can begin suddenly or happen over time, usually after working, exercising, or playing in the heat.",heat exhaustion
What are the signs and symptoms of heat exhaustion?,"Signs and symptoms of heat exhaustion include cool, moist skin with goosebumps when in the heat, heavy sweating, faintness, dizziness, fatigue, weak and rapid pulse, low blood pressure upon standing, muscle cramps, nausea or vomiting, headache, extreme thirst, mild confusion, and decreased urine output.",heat exhaustion
What should you do if you suspect someone has heat exhaustion?,"If you suspect someone has heat exhaustion, move the person out of the heat and into a shady or air-conditioned place, lay the person down and elevate the legs and feet slightly, remove tight or heavy clothing, have the person sip chilled water, a decaffeinated sports drink containing electrolytes or other nonalcoholic beverage without caffeine, cool the person by spraying or sponging with cool water and fanning, and monitor the person carefully. Contact a health care provider if signs or symptoms worsen or if the person doesn't improve after taking first-aid measures.",heat exhaustion
When should you call 911 or your local emergency number?,"You should call 911 or your local emergency number if the person's condition gets worse, especially if he or she experiences fainting, agitation, confusion, seizures, inability to drink, or a core body temperature measured by rectal thermometer of 104 F (40 C) (heatstroke).",heat exhaustion
What is choking?,Choking happens when an object lodges in the throat or windpipe blocking the flow of air.,choking
What are the signs of choking?,"Signs of choking include one or both hands clutched to the throat, a look of panic, shock or confusion, inability to talk, strained or noisy breathing, squeaky sounds when trying to breathe, cough, which may either be weak or forceful, skin, lips and nails that change color turning blue or gray and loss of consciousness.",choking
What should you do if a choking person can cough forcefully?,"If a choking person can cough forcefully, let the person keep coughing. Coughing might naturally remove the stuck object.",choking
"What should you do if a person can't cough, talk, cry or laugh forcefully?","If a person can't cough, talk, cry or laugh forcefully, give first aid to the person.",choking
What are the steps for first aid for a choking person?,The American Red Cross recommends the following steps: 1) Give five back blows. 2) Give five abdominal thrusts. 3) Alternate between five blows and five thrusts until the blockage is dislodged.,choking
How do you perform abdominal thrusts on someone else?,"To give abdominal thrusts to someone else, stand behind the person. For a child, kneel down behind. Place one foot slightly in front of the other for balance. Wrap your arms around the waist. Tip the person forward slightly. Make a fist with one hand. Put it just above the person's navel. Grasp the fist with the other hand. Press into the stomach, also called the abdomen, with a quick, upward thrust — as if trying to lift the person up. For a child, use gentle yet firm pressure to avoid damaging the internal organs. Give five abdominal thrusts. Check if the blockage has been removed. Repeat as needed.",choking
What should you do if you are the only rescuer?,"If you're the only rescuer, give back blows and abdominal thrusts first. Then call 911 or your local emergency number for help.",choking
What should you do if the person becomes unconscious?,"If the person becomes unconscious, start standard cardiopulmonary resuscitation (CPR) with chest compressions and rescue breaths.",choking
What should you do if the person is pregnant or if you can't get your arms around the stomach?,"Give chest thrusts. Put your hands at the base of the breastbone, just above the joining of the lowest ribs. Press hard into the chest with a quick thrust. This is the same action as the Heimlich maneuver. Repeat until the blockage is removed from the airway.",choking
What should you do to clear the airway of an unconscious person who is choking?,"Lower the person onto the floor, with the back on the floor and arms to the sides. Clear the airway. If you can see the object, reach a finger into the mouth to sweep out the object. Never finger sweep if you can't see the object. You risk pushing the blockage deeper into the airway. This is very risky with young children. Begin CPR if the person still doesn't respond. If the airway is still blocked, use chest compressions such as those that are used in CPR to remove the stuck object. Only use two rescue breaths per cycle. Recheck the mouth regularly for the object.",choking
What should you do to clear the airway of a choking infant younger than age 1?,Sit and hold the infant facedown on your forearm. Rest your forearm on your thigh. Hold the infant's chin and jaw to support the head. Place the head lower than the trunk. Thump the infant gently but firmly five times on the middle of the back. Use the heel of your hand. Point your fingers up so that you don't hit the back of the infant's head. Gravity and the back thumps should release the blockage. Turn the infant faceup on your forearm if breathing hasn't started. Rest your arm on your thigh. Place the infant's head lower than the trunk. Give five gentle but firm chest compressions with your fingers. Place two fingers just below the nipple line. Press down about 1 1/2 inches. Let the chest rise between each compression. Repeat the back thumps and chest compressions if breathing doesn't start. Call for emergency medical help. Begin infant CPR if the airway is clear but the infant doesn't start breathing.,choking
What should you do if you're alone and choking?,"Call 911 or your local emergency number right away. Then, give yourself abdominal thrusts, also called the Heimlich maneuver, to remove the stuck object. Place a fist slightly above your navel. Grasp your fist with the other hand. Bend over a hard surface. A countertop or chair will do. Shove your fist inward and upward.",choking
What is a dislocation?,A dislocation is an injury in which the ends of your bones are forced from their normal positions.,dislocation
What is the usual cause of dislocation?,"The cause is usually trauma resulting from a fall, an auto accident, or a collision during contact or high-speed sports.",dislocation
Which joints are usually involved in dislocation?,"Dislocation usually involves the body's larger joints. In adults, the most common site of the injury is the shoulder. In children, it's the elbow. Your thumb and fingers also are vulnerable if forcibly bent the wrong way.",dislocation
What are the symptoms of dislocation?,The injury will temporarily deform and immobilize your joint and may result in sudden and severe pain and swelling.,dislocation
What should you do if you believe you have dislocated a joint?,"Don't delay medical care. Get medical help immediately. Don't move the joint. Until you receive help, splint the affected joint into its fixed position. Don't try to move a dislocated joint or force it back into place. This can damage the joint and its surrounding muscles, ligaments, nerves or blood vessels. Put ice on the injured joint. This can help reduce swelling by controlling internal bleeding and the buildup of fluids in and around the injured joint.",dislocation
Why should you not try to move a dislocated joint back into place?,"This can damage the joint and its surrounding muscles, ligaments, nerves or blood vessels.",dislocation
What should you do if you swallow a foreign object?,"If you swallow a foreign object and it is stuck in your esophagus or blocks your airway and causes choking, seek immediate medical attention. If you have food stuck in the esophagus, you can try to drink a carbonated beverage to see if that will help it pass.",foreign object swallowed
What are the symptoms of an object stuck in the esophagus?,Symptoms include pain from the throat down the middle of the chest and regurgitating food or drink.,foreign object swallowed
What should you do if someone is choking on a foreign object?,"If a choking person can cough forcefully, let the person keep coughing. Coughing might naturally remove the stuck object. If a person can't cough, talk, cry or laugh forcefully, give first aid to the person. The American Red Cross recommends giving five back blows and five abdominal thrusts, alternating between the two, until the blockage is dislodged. If the choking person becomes unconscious, clear the airway and begin CPR.",foreign object swallowed
What should you do if the choking person becomes unconscious?,"If the choking person becomes unconscious, lower the person onto the floor, clear the airway, and begin CPR if the person still doesn't respond. Recheck the mouth regularly for the object.",foreign object swallowed
How do you give abdominal thrusts to someone else?,"Stand behind the person and place one foot slightly in front of the other for balance. Wrap your arms around the waist and tip the person forward slightly. Make a fist with one hand and put it just above the person's navel. Grasp the fist with the other hand and press into the stomach with a quick, upward thrust – as if trying to lift the person up. For a child, use gentle yet firm pressure to avoid damaging the internal organs. Give five abdominal thrusts and check to see if the blockage has been removed. Repeat as needed.",foreign object swallowed
What should you do if an object is stuck in your esophagus?,"If an object is stuck in your esophagus, you may need to have it removed by your health care provider. See your provider right away if the object is sharp or pointed, a button battery, or a magnet.",foreign object swallowed
What are the symptoms of having a foreign object stuck in the esophagus?,Symptoms include pain from the throat down the middle of the chest and regurgitating food or drink.,foreign object swallowed
What should you do if a person is choking and can't cough or talk forcefully?,"If a person can't cough, talk, cry or laugh forcefully, give first aid to the person. Give five back blows and five abdominal thrusts, also known as the Heimlich maneuver, alternately until the blockage is dislodged.",foreign object swallowed
What should you do if a choking person becomes unconscious?,"Lower the person onto the floor, clear the airway, and begin CPR if the person still doesn't respond. If the airway is still blocked, use chest compressions such as those that are used in CPR to remove the stuck object.",foreign object swallowed
What should you do if you're choking and alone?,"Call 911 or your local emergency number right away. Then give yourself abdominal thrusts, also called the Heimlich maneuver, to remove the stuck object.",foreign object swallowed
What should you do if the person is pregnant or if you can't get your arms around the stomach?,"If the person is pregnant or if you can't get your arms around the stomach, give chest thrusts. Put your hands on the chest, place them at the base of the breastbone, and press hard into the chest with a quick thrust. Repeat until the blockage is removed from the airway.",foreign object swallowed
What can you do to prepare for situations like this?,"To prepare for situations like this, learn the Heimlich maneuver and CPR in a certified first-aid training course.",foreign object swallowed
What is poisoning?,"Poisoning is injury or death due to swallowing, inhaling, touching or injecting various drugs, chemicals, venoms or gases. Many substances — such as drugs and carbon monoxide — are poisonous only in higher concentrations or dosages.",poisoning
