question,answer,tags
What should you do for self-care if you have a toothache?,"Until you can see your dentist, try these self-care tips for a toothache: rinse your mouth with warm water, use dental floss to remove any food particles or plaque wedged between your teeth, consider taking an over-the-counter (OTC) pain reliever to dull the ache, but don't place aspirin or another painkiller directly against your gums because it may burn your gum tissue, and if the toothache is caused by trauma to the tooth, apply a cold compress to the outside of your cheek.",toothache
What should you be cautious of when using products containing benzocaine for toothache relief?,"Use caution with products containing benzocaine. Talk to your dentist or doctor before using an OTC antiseptic containing benzocaine, don't use any products that contain benzocaine — such as teething gels with benzocaine (Anbesol, Orabase, Orajel, others) — in children younger than 2 years old, never use more than the recommended dose of benzocaine, and store products containing benzocaine out of the reach of children.",toothache
When should you call your dentist immediately if you have a toothache?,"Call your dentist immediately if you have any of the following with a toothache: pain that persists for more than a day or two, fever, signs and symptoms of infection, such as swelling, pain when you bite, red gums or a foul-tasting discharge, trouble breathing or swallowing.",toothache
What are the symptoms of a foreign object in the ear for small children?,"Small children may have symptoms such as ear pain, crankiness or crying.",foreign object in the ear
When should you seek help if a foreign object is lodged in the ear?,"If there is bleeding, severe pain, drainage or signs of infection, see a health care provider right away. Also, if you know the object is a battery, seek help right away. And if you can't easily see the object and you've tried removing it more than once, stop and get care. Delays and many failed tries to remove it can lead to infection and damage.",foreign object in the ear
What should you never do if you have a foreign object in your ear?,"Never poke or prod the object. If you use tools such as cotton swabs or matchsticks to pry an object out, they can push it deeper into the ear. This may cause more damage.",foreign object in the ear
What should you use to remove a foreign object in the ear if it's easy to see and grasp?,Use tweezers to gently remove it.,foreign object in the ear
What should you use to wash out the ear canal if you don't think there is a hole in the eardrum and no ear tubes are in place?,"Use a rubber-bulb syringe and warm water to wash the object out of the canal. Don't use water to remove batteries, food or plant material.",foreign object in the ear
What should you use for an insect stuck in the ear?,"If the object is an insect, tilt the head so that the ear with the insect is upward. Pour alcohol or warm, but not hot, oil into the ear. The oil can be mineral oil, olive oil or baby oil. The insect should float out. Don't use oil if you think there is a hole in the eardrum or if ear tubes are in place.",foreign object in the ear
When should you see a health care provider right away if you have a foreign object in your ear?,"If you can't remove the object easily the first time, get help. Also, if the person continues to have pain, discharge from the ear canal, problems hearing or feeling there is something lodged in the ear, see a health care provider.",foreign object in the ear
What should you do if a blister isn't too painful?,"If a blister isn't too painful, try to keep it intact. Unbroken skin over a blister may provide a natural barrier to bacteria and decreases the risk of infection. Cover it with a bandage or moleskin. Cut a piece of moleskin into a doughnut shape and place the pad so that it encircles and protects the blister. Then cover the blister and moleskin with gauze.",blister
When should you seek medical care for a blister?,"Seek medical care if the blister looks infected. If you have diabetes or poor circulation, call your doctor before treating the blister yourself.",blister
How can you drain a blister to relieve pain?,"To relieve blister-related pain, drain the fluid while leaving the overlying skin intact. Wash your hands and the blister with soap and warm water. Swab the blister with iodine. Clean a sharp needle with rubbing alcohol. Use the needle to prick the blister in several spots near the edge. Let the fluid drain, but leave the overlying skin in place. Apply an ointment such as petroleum jelly to the blister and cover it with a nonstick gauze bandage. If a rash appears, stop using the ointment. Check the area every day for infection. After several days, use a tweezers and scissors sterilized with rubbing alcohol to cut away the dead skin. Apply more ointment and a bandage.",blister
What can you do to prevent friction blisters?,"To prevent friction blisters on your feet, wear shoes that fit well. It also helps to use moisture-wicking socks. Try the various socks, shoes and insoles that are designed specifically to help reduce blistering. You might also try attaching moleskin to the inside of your shoes where it might rub. Or you can dust the inside of your socks with foot powder. Gloves help prevent blisters on your hands.",blister
What is a fever?,A fever is a rise in body temperature. It's usually a sign of infection.,fever
What is the average body temperature range?,The average body temperature range is between 97 F (36.1 C) and 99 F (37.2 C) or more.,fever
How do you know if you have a fever?,"A rectal, ear, or temporal artery temperature of 100.4 (38 C) or higher, an oral temperature of 100 F (37.8 C) or higher, or an armpit temperature of 99 F (37.2 C) or higher generally indicate a fever.",fever
Should a fever be treated?,Treating a fever neither shortens nor particularly prolongs the course of an illness. The main goal is to relieve discomfort and promote rest.,fever
What are some home care strategies for treating a fever in children?,"Encourage your child to drink fluids, dress your child in lightweight clothing, use a light blanket if your child feels chilled until the chills end, and give your child acetaminophen or ibuprofen if they are 6 months old or older.",fever
When should medical advice be sought for a child with a fever?,"Medical care should be sought if a child of any age shows signs of fussiness or acting abnormally which doesn't improve even after taking medications to bring down the fever, signs and symptoms of dehydration, a stiff neck or headache, abdominal pain, trouble breathing, rash, joint pain or swelling, or if the fever lasts more than five days in a row.",fever
What are some home care strategies for treating a fever in adults?,"Drink plenty of fluids to stay hydrated, dress in lightweight clothing, use a light blanket if you feel chilled until the chills end, and take acetaminophen or ibuprofen following the directions on the label.",fever
When should medical advice be sought for an adult with a fever?,"Medical care should be sought if someone with a fever has difficulty breathing, chest pain, severe headache, confusion or agitation, abdominal pain, repeated vomiting, dry mouth, decreased or dark urine, or refusal to drink fluids, which may indicate dehydration, skin rashes, difficulty swallowing fluids, pain with urination or pain in the back.",fever
When should emergency medical care be sought for a child with a fever?,"Emergency medical care should be sought if a child has a fever after being left in a hot car or involved in another such potentially dangerous situation and shows any of these warning signs: fever with no sweating, severe headache, seizures, stiff neck, confusion, repeated vomiting or diarrhea, irritability or significant discomfort, or any worrisome, different, or unusual symptoms.",fever
What type of thermometer should be used to check someone's temperature?,Always use a digital thermometer to check someone's temperature.,fever
What types of digital thermometers are available to check temperature?,"Various types of digital thermometers are available including rectal, oral, temporal artery, armpit, and ear thermometers.",fever
Why are glass mercury thermometers no longer recommended?,Glass mercury thermometers have been phased out and are no longer recommended due to the potential for mercury exposure or ingestion.,fever
What precautions should be taken when using a digital thermometer?,"Read the instructions that came with the thermometer, clean the thermometer before and after each use with rubbing alcohol or soap and lukewarm water, don't use the same thermometer for both oral and rectal temperatures, get two and label which is used where, and never leave a child unattended while taking his or her temperature.",fever
How to take rectal temperature for infants?,"Turn on the digital thermometer and dab petroleum jelly or another lubricant on the tip of the thermometer. Lay the child on his or her stomach or side, with knees flexed. Carefully insert the tip 1/2 to 1 inch (1.3 to 2.5 centimeters) into the rectum. Hold the thermometer and child still until the thermometer beep indicates it's done. To avoid injury, don't let go of the thermometer while it's inside the child. Remove the thermometer and read the number.",fever
How to take oral temperature?,Turn on the digital thermometer. Place the thermometer tip under the tongue. Close the mouth around the thermometer for the recommended amount of time or until the thermometer beep indicates it's done. Remove the thermometer and read the number.,fever
How to take temporal artery temperature?,Turn on the digital thermometer. Gently sweep it across the forehead and read the number.,fever
How to take armpit temperature?,"Turn on the digital thermometer. Place the thermometer under the armpit, making sure it touches skin, not clothing. Hold the thermometer tightly in place until you hear the thermometer beep indicating it's done. Remove the thermometer and read the number.",fever
How to take ear temperature?,Turn on the digital thermometer. Gently place it in the ear canal no further than indicated by the instructions that came with the device. Hold the thermometer tightly in place until you hear the thermometer beep indicating it's done. Remove the thermometer and read the number.,fever
What are chemical burns?,"Chemical burns are tissue damage caused by strong acids, drain cleaners, paint thinner, gasoline and many other substances.",chemical burns
When should you seek emergency care for a chemical burn?,"You should seek emergency medical help for major chemical burns, which are deep, involve all layers of the skin, are larger than 3 inches (about 8 centimeters) in diameter, cover the hands, feet, face, groin, buttocks, or a major joint or encircles an arm or leg, or might cause shock, with symptoms such as cool, clammy skin, weak pulse and shallow breathing.",chemical burns
What should you do if you're unsure whether you've been exposed to a toxic chemical?,"If you're unsure you've been exposed to a toxic chemical, call a poison control center then call 911. In the United States, you can get help from Poison Control online at www.poison.org or by calling 800-222-1222. Both options are free, confidential and available 24 hours a day. If you seek emergency medical help, take the container or the name of the chemical with you.",chemical burns
What are the first aid steps for a chemical burn?,"If you think you have a chemical burn, take these steps immediately: remove dry chemicals, remove contaminated clothing or jewelry and rinse chemicals off for at least 20 minutes, in a shower if it's available, bandage the burn, cover the burn with a clean bandage, and rinse again if needed. If you feel more burning, rinse the area again for several more minutes.",chemical burns
What is a bruise?,"A bruise forms when blood vessels under the skin break. The trapped blood creates a bruise that's black, purple or blue then changes color as it heals.",bruise
How can you enhance bruise healing?,"You can enhance bruise healing by elevating the bruised area above heart level if possible, applying an ice pack wrapped in a thin towel, and repeating several times for a day or two after the injury. This helps to reduce the swelling and pain. If the bruised area is swelling, put an elastic bandage around it, but not too tight.",bruise
Do you need to bandage a bruise if the skin isn't broken?,"If the skin isn't broken, you don't need to bandage a bruise. Consider taking a nonprescription pain reliever if needed.",bruise
When should you consult your health care provider for a bruise?,"You should consult your health care provider if you have very painful swelling in the bruised area, suspect a bruise has been caused by child abuse, domestic violence or elder abuse, are still experiencing pain three days after a seemingly minor injury, have frequent, large or painful bruises, have bruises that begin suddenly or seem to develop for no reason, have a personal or family history of easy bruising or bleeding, notice a lump form over the bruise, which may be a sign of pooling blood, also called a hematoma, or have unusual bleeding, such as from the nose or gums.",bruise
What is shock?,"Shock is a critical condition that occurs when there is a sudden drop in blood flow throughout the body. This can be caused by a variety of factors including trauma, blood loss, severe burns, severe infection, or poisoning.",shock
What are the signs and symptoms of shock?,"Signs and symptoms of shock can vary depending on the circumstances but may include cool, clammy skin; pale or ashen skin; rapid pulse; rapid breathing; nausea or vomiting; weakness or fatigue; dizziness or fainting; changes in mental status or behavior; or an enlarged pupils.",shock
What should I do if I suspect someone is in shock?,"If you suspect a person is in shock, call 911 or your local emergency number. Then immediately lay the person down and elevate their legs and feet slightly unless you think this may cause pain or further injury. Keep the person still and begin CPR if the person shows no signs of life, such as not breathing, coughing, or moving. Loosen tight clothing and cover the person with a blanket to prevent chilling. Do not let the person eat or drink anything. If the person is bleeding, hold pressure over the bleeding area using a towel or sheet. If the person vomits or begins bleeding from the mouth, and no spinal injury is suspected, turn him or her onto a side to prevent choking.",shock
What should I do if the person is having an allergic reaction and I have an epinephrine autoinjector?,"If you suspect that the person is having an allergic reaction and you have access to an epinephrine autoinjector, use it according to its instructions.",shock
What should you do if you suspect someone has a spinal injury?,Get help. Call 911 or emergency medical help.,spinal injury
What should you do to prevent movement of the neck and head in someone with a suspected spinal injury?,Place heavy towels or rolled sheets on both sides of the neck or hold the head and neck to prevent movement.,spinal injury
When should you begin chest compressions on someone with a suspected spinal injury?,"If the person shows no signs of circulation (breathing, coughing or movement), begin CPR, but do not tilt the head back to open the airway. Use your fingers to gently grasp the jaw and lift it forward. If the person has no pulse, begin chest compressions.",spinal injury
Should you remove a helmet if someone is wearing one and has a suspected spinal injury?,"No, if the person is wearing a helmet, don't remove it. A football helmet facemask should be removed if you need to access the airway.",spinal injury
What should you do if you need to roll someone with a suspected spinal injury?,"If you must roll the person because he or she is vomiting, choking on blood or because you have to make sure the person is still breathing, you need at least one other person. With one of you at the head and another along the side of the injured person, work together to keep the person's head, neck and back aligned while rolling the person onto one side.",spinal injury
What are heat cramps?,"Heat cramps are painful, involuntary muscle spasms that usually occur during heavy exercise in hot environments.",heat cramps
What contributes to heat cramps?,Fluid and electrolyte loss often contribute to heat cramps.,heat cramps
Which muscles are most often affected by heat cramps?,"Muscles most often affected include those of your calves, arms, abdominal wall and back, although heat cramps may involve any muscle group involved in exercise.",heat cramps
What should you do if you suspect heat cramps?,"Rest briefly and cool down, drink clear juice or an electrolyte-containing sports drink, practice gentle, range-of-motion stretching and gentle massage of the affected muscle group, and don't resume strenuous activity for several hours or longer after heat cramps go away.",heat cramps
When should you call your doctor if you have heat cramps?,You should call your doctor if your cramps don't go away within one hour or so.,heat cramps
What is heatstroke?,Heatstroke occurs when your body temperature rises rapidly and you're unable to cool down. It can be life-threatening by causing damage to your brain and other vital organs. It may be caused by strenuous activity in the heat or by being in a hot place for too long.,heatstroke
What are the signs and symptoms of heatstroke?,"Heatstroke signs and symptoms include: fever of 104 degrees Fahrenheit (40 degrees Celsius) or greater, changes in mental status or behavior such as confusion, agitation and slurred speech, hot, dry skin or heavy sweating, nausea and vomiting, flushed skin, rapid pulse, rapid breathing, headache, fainting, seizure, and coma.",heatstroke
What should I do if I suspect someone is experiencing heatstroke?,"If you suspect heatstroke, call 911 or your local emergency number. Then move the person out of the heat right away. Cool the person by whatever means available. For example: put the person in a cool tub of water or a cool shower, spray the person with a garden hose, sponge the person with cool water, fan the person while misting with cool water, place ice packs or cool wet towels on the neck, armpits and groin, or cover the person with cool damp sheets. If the person is conscious, offer chilled water, a sports drink containing electrolytes or other nonalcoholic beverage without caffeine.",heatstroke
What should I do if the person loses consciousness?,"Begin CPR if the person loses consciousness and shows no signs of circulation, such as breathing, coughing or movement.",heatstroke
What should I do immediately after getting a black eye?,"Apply a cold compress soon after the injury. Using gentle pressure, place a cold pack, a cloth filled with ice — or even a bag of frozen vegetables — to the area around your eye. Take care not to press on the eye itself. Apply cold as soon as possible after the injury to reduce swelling. Repeat several times a day for a day or two.",black eye
When should I seek urgent medical care for a black eye?,"If you see blood in the white or colored parts of the eye, seek urgent care by an eye specialist (ophthalmologist).",black eye
When should I seek medical care right away for a black eye?,"Seek medical care right away if you have vision problems, such as double vision or blurring. Also seek care right away if you have severe pain, bruising around both eyes, or bleeding in an eye or from the nose.",black eye
When can I apply warm or hot compresses to a black eye?,Apply warm or hot compresses after a few days when the swelling has gone down. Repeat several times a day for a day or two.,black eye
What should I do if I see severe bleeding?,Call 911 or your local emergency number if the wound is deep or you're not sure how serious it is. Don't move the injured person except if needed to avoid further injury.,severe bleeding
What should I do before checking for the source of the wound?,Put on disposable gloves and other personal protective equipment if you have them. Remove any clothing or debris from the wound.,severe bleeding
How can I stop the bleeding?,Cover the wound with sterile gauze or a clean cloth. Press on it firmly with the palm of your hand until bleeding stops. But don't press on an eye injury or embedded object. Don't press on a head wound if you suspect a skull fracture.,severe bleeding
What should I do if the blood seeps through the bandage?,Add more gauze or cloth on top of the existing bandage. Then keep pressing firmly on the area.,severe bleeding
When should I apply a tourniquet?,"A tourniquet is effective in controlling life-threatening bleeding from a limb. Apply a commercially made tourniquet if it's available and you're trained in how to use it. Don't use an improvised tourniquet, such as a scarf or a belt.",severe bleeding
What should I do if I'm waiting for emergency help to arrive?,Try to keep the injured person from moving.,severe bleeding
What should I do after helping the injured person?,"Wash your hands, even if it doesn't look like any blood got on your hands.",severe bleeding
What are the causes of burns?,"Burns can be caused by hot liquids, the sun, flames, chemicals, electricity, steam, and other factors.",burns
When should you seek emergency medical help for a burn?,"You should seek emergency medical help for a burn if it is deep, involving all layers of the skin, causes the skin to be dry and leathery, appears charred or has patches of white, brown or black, is larger than 3 inches (about 8 centimeters) in diameter, covers the hands, feet, face, groin, buttocks or a major joint, encircles an arm or leg, is accompanied by smoke inhalation, or begins swelling very quickly. Electrical burns, including those caused by lightning, and major chemical burns also require emergency medical care. A minor burn might need emergency care if it affects the eyes, mouth, hands or genital areas. Babies and older adults might need emergency care for minor burns as well.",burns
What should you do until emergency help arrives for a major burn?,"Until emergency help arrives for a major burn, you should protect the burned person from further harm, make certain that the person burned is breathing, remove jewelry, belts, and other tight items, cover the burn loosely with gauze or a clean cloth, raise the burned area above heart level if possible, and watch for signs of shock.",burns
What should you do for a minor burn?,"For a minor burn, you should cool the burn by holding the area under cool (not cold) running water for about 10 minutes. If the burn is on the face, apply a cool, wet cloth until the pain eases. For a mouth burn from hot food or drink, put a piece of ice in the mouth for a few minutes. Remove rings or other tight items from the burned area. Don't break blisters. Apply lotion, such as one with aloe vera or cocoa butter. Bandage the burn with a clean bandage, and wrap it loosely to avoid putting pressure on burned skin. If needed, take a nonprescription pain reliever, such as ibuprofen (Advil, Motrin IB, others), naproxen sodium (Aleve) or acetaminophen (Tylenol, others).",burns
Why is it important to have access to key health information during an emergency?,"During an emergency, medical service providers need to have access to key health information for anyone who needs assistance. This information can help them provide proper and timely medical care.",emergency health information
What information should be included in a health record?,"A health record should include your name, age, sex, address, medication names, doses and schedules, medical equipment, chronic medical conditions, medical consent form, aspects of your health history that could be helpful to emergency medical responders, including allergies and immunization record, phone numbers for professional emergency contacts, such as your family doctor, local emergency services, emergency road service providers, and the regional poison control center, and phone numbers for a personal emergency contact, such as a friend or a family member who you've asked to serve in this role.",emergency health information
What are some options for storing your health information online?,"Two options for storing your health information online include free or subscription-based personal health records (PHRs) and patient portals. Many health care providers, insurance companies and employers offer their clients or staff access to their electronic health record via patient portals.",emergency health information
What are some other storage options for emergency health information?,"Other storage options for emergency health information include print versions, where you keep a number of print copies in handy places, such as your purse, vehicle glove box, first aid kit and emergency kit. You could even try making one small enough to fit in your wallet or on an index card. Consider posting the index card on your refrigerator door so emergency personnel can see it quickly if needed. Another option is to put the list on a portable digital device, such as a cell phone or thumb drive, that you keep with you.",emergency health information
What is a patient portal?,"A patient portal is an electronic health information tool offered by many insurance companies, employers, and health care institutions. It allows patients to access their electronic health record and communicate with their health care provider.",emergency health information
